q_id,doc_id,question,answer,doc_path,documents,evidence,title,abstract
6992f8e5a33f0af0f2206769484c72fecc14700b,1811.01088,Does the paper compare the performance of models trained with STILTs to BERT and ELMo on the same tasks from the GLUE benchmark?,"[{'answer': 'Yes', 'type': 'boolean'}]",1811.01088.pdf,"['1811.01088.pdf', '1904.10503.pdf', '1912.00864.pdf', '1909.00754.pdf']","FLOAT SELECTED: Table 1: GLUE results with and without STILTs, fine-tuning on full training data of each target task. Bold marks the best within each section. Strikethrough indicates cases where the intermediate task is the same as the target taskâ€”we substitute the baseline result for that cell. A.Ex is the average excluding MNLI and QQP because of the overlap with intermediate tasks. See text for discussion of WNLI results. Test results on STILTs uses the supplementary training regime for each task based on the performance on the development set, corresponding to the numbers shown in Best of Each. The aggregated GLUE scores differ from the public leaderboard because we report performance on QNLIv1.",Sentence Encoders on STILTs: Supplementary Training on Intermediate Labeled-data Tasks,"Pretraining sentence encoders with language modeling and related unsupervised
tasks has recently been shown to be very effective for language understanding
tasks. By supplementing language model-style pretraining with further training
on data-rich supervised tasks, such as natural language inference, we obtain
additional performance improvements on the GLUE benchmark. Applying
supplementary training on BERT (Devlin et al., 2018), we attain a GLUE score of
81.8---the state of the art (as of 02/24/2019) and a 1.4 point improvement over
BERT. We also observe reduced variance across random restarts in this setting.
Our approach yields similar improvements when applied to ELMo (Peters et al.,
2018a) and Radford et al. (2018)'s model. In addition, the benefits of
supplementary training are particularly pronounced in data-constrained regimes,
as we show in experiments with artificially limited training data."
38c74ab8292a94fc5a82999400ee9c06be19f791,2002.10361,"What is the total number of documents in the multilingual Twitter corpus for hate speech detection, covering English, Italian, Polish, Portuguese, and Spanish datasets?","[{'answer': 'It contains 106,350 documents', 'type': 'abstractive'}]",2002.10361.pdf,"['2002.10361.pdf', '1810.09774.pdf', '1908.11047.pdf', '1902.09393.pdf']","FLOAT SELECTED: Table 1: Statistical summary of multilingual corpora across English, Italian, Polish, Portuguese and Spanish. We present number of users (Users), documents (Docs), and average tokens per document (Tokens) in the corpus, plus the label distribution (HS Ratio, percent of documents labeled positive for hate speech).",Multilingual Twitter Corpus and Baselines for Evaluating Demographic Bias in Hate Speech Recognition,"Existing research on fairness evaluation of document classification models
mainly uses synthetic monolingual data without ground truth for author
demographic attributes. In this work, we assemble and publish a multilingual
Twitter corpus for the task of hate speech detection with inferred four author
demographic factors: age, country, gender and race/ethnicity. The corpus covers
five languages: English, Italian, Polish, Portuguese and Spanish. We evaluate
the inferred demographic labels with a crowdsourcing platform, Figure Eight. To
examine factors that can cause biases, we take an empirical analysis of
demographic predictability on the English corpus. We measure the performance of
four popular document classifiers and evaluate the fairness and bias of the
baseline classifiers on the author-level demographic attributes."
12159f04e0427fe33fa05af6ba8c950f1a5ce5ea,1705.01265,"Which hyperparameters, including the number of clusters, word embedding dimensions, and others, were adjusted in the systematic evaluation of clustered word embeddings across named entity recognition and sentiment classification tasks, as described in the paper?","[{'answer': 'number of clusters, seed value in clustering, selection of word vectors, window size and dimension of embedding', 'type': 'abstractive'}, {'answer': 'different number of clusters, different embeddings', 'type': 'extractive'}]",1705.01265.pdf,"['1705.01265.pdf', '1809.08298.pdf', '2003.04642.pdf', '1911.02821.pdf', '1906.11180.pdf', '1603.00968.pdf', '1705.00108.pdf']",We cluster the embeddings with INLINEFORM0 -Means.,On the effectiveness of feature set augmentation using clusters of word embeddings,"Word clusters have been empirically shown to offer important performance
improvements on various tasks. Despite their importance, their incorporation in
the standard pipeline of feature engineering relies more on a trial-and-error
procedure where one evaluates several hyper-parameters, like the number of
clusters to be used. In order to better understand the role of such features we
systematically evaluate their effect on four tasks, those of named entity
segmentation and classification as well as, those of five-point sentiment
classification and quantification. Our results strongly suggest that cluster
membership features improve the performance."
e829f008d62312357e0354a9ed3b0827c91c9401,2001.05493,"What specific psycholinguistic and basic linguistic features, including punctuation and emoticons, are utilized as meta-data to support aggression detection in both code-mixed and uni-lingual English texts as described in this paper's unified system?","[{'answer': 'Emotion Sensor Feature, Part of Speech, Punctuation, Sentiment Analysis, Empath, TF-IDF Emoticon features', 'type': 'abstractive'}]",2001.05493.pdf,"['2001.05493.pdf', '1904.10500.pdf', '1908.10084.pdf', '1910.14497.pdf', '1809.01202.pdf', '1801.05147.pdf']","Exploiting psycho-linguistic features with basic linguistic features as meta-data. The main aim is to minimize the direct dependencies on in-depth grammatical structure of the language (i.e., to support code-mixed data). We have also included emoticons, and punctuation features with it. We use the term ""NLP Features"" to represent it in the entire paper.",A Unified System for Aggression Identification in English Code-Mixed and Uni-Lingual Texts,"Wide usage of social media platforms has increased the risk of aggression,
which results in mental stress and affects the lives of people negatively like
psychological agony, fighting behavior, and disrespect to others. Majority of
such conversations contains code-mixed languages[28]. Additionally, the way
used to express thought or communication style also changes from one social
media plat-form to another platform (e.g., communication styles are different
in twitter and Facebook). These all have increased the complexity of the
problem. To solve these problems, we have introduced a unified and robust
multi-modal deep learning architecture which works for English code-mixed
dataset and uni-lingual English dataset both.The devised system, uses
psycho-linguistic features and very ba-sic linguistic features. Our multi-modal
deep learning architecture contains, Deep Pyramid CNN, Pooled BiLSTM, and
Disconnected RNN(with Glove and FastText embedding, both). Finally, the system
takes the decision based on model averaging. We evaluated our system on English
Code-Mixed TRAC 2018 dataset and uni-lingual English dataset obtained from
Kaggle. Experimental results show that our proposed system outperforms all the
previous approaches on English code-mixed dataset and uni-lingual English
dataset."
171ebfdc9b3a98e4cdee8f8715003285caeb2f39,1909.08859,How does the Procedural Reasoning Network (PRN) model perform in terms of accuracy in single-task and multi-task training on the visual reasoning tasks in the RecipeQA dataset compared to the previous best models?,"[{'answer': 'Average accuracy of proposed model vs best prevous result:\nSingle-task Training: 57.57 vs 55.06\nMulti-task Training: 50.17 vs 50.59', 'type': 'abstractive'}]",1909.08859.pdf,"['1909.08859.pdf', '1906.05474.pdf', '2002.01207.pdf', '1805.04033.pdf', '1909.08824.pdf', '2002.06644.pdf', '1806.04511.pdf', '1809.04960.pdf', '1909.05855.pdf', '1909.02480.pdf']","Table TABREF29 presents the quantitative results for the visual reasoning tasks in RecipeQA. In single-task training setting, PRN gives state-of-the-art results compared to other neural models.",Procedural Reasoning Networks for Understanding Multimodal Procedures,"This paper addresses the problem of comprehending procedural commonsense
knowledge. This is a challenging task as it requires identifying key entities,
keeping track of their state changes, and understanding temporal and causal
relations. Contrary to most of the previous work, in this study, we do not rely
on strong inductive bias and explore the question of how multimodality can be
exploited to provide a complementary semantic signal. Towards this end, we
introduce a new entity-aware neural comprehension model augmented with external
relational memory units. Our model learns to dynamically update entity states
in relation to each other while reading the text instructions. Our experimental
analysis on the visual reasoning tasks in the recently proposed RecipeQA
dataset reveals that our approach improves the accuracy of the previously
reported models by a large margin. Moreover, we find that our model learns
effective dynamic representations of entities even though we do not use any
supervision at the level of entity states."
897ba53ef44f658c128125edd26abf605060fb13,1611.04798,Does the paper report results for English-to-German translation in a simulated under-resourced scenario using their proposed multilingual NMT framework?,"[{'answer': 'Yes', 'type': 'boolean'}, {'answer': 'Yes', 'type': 'boolean'}]",1611.04798.pdf,"['1611.04798.pdf', '1603.00968.pdf', '1908.05434.pdf', '1706.08032.pdf', '1904.01608.pdf', '2003.12218.pdf', '1910.07481.pdf', '1808.09029.pdf', '1909.01013.pdf', '2003.01769.pdf', '1909.08824.pdf']",FLOAT SELECTED: Table 1: Results of the Englishâ†’German systems in a simulated under-resourced scenario.,Toward Multilingual Neural Machine Translation with Universal Encoder and Decoder,"In this paper, we present our first attempts in building a multilingual
Neural Machine Translation framework under a unified approach. We are then able
to employ attention-based NMT for many-to-many multilingual translation tasks.
Our approach does not require any special treatment on the network architecture
and it allows us to learn minimal number of free parameters in a standard way
of training. Our approach has shown its effectiveness in an under-resourced
translation scenario with considerable improvements up to 2.6 BLEU points. In
addition, the approach has achieved interesting and promising results when
applied in the translation task that there is no direct parallel corpus between
source and target languages."
6412e97373e8e9ae3aa20aa17abef8326dc05450,1610.00879,What is the baseline human evaluation method used to compare against the classifier performance on Dataset-H?,"[{'answer': 'Human evaluators', 'type': 'abstractive'}]",1610.00879.pdf,"['1610.00879.pdf', '2001.05493.pdf', '1910.11235.pdf', '1611.02550.pdf', '1909.00252.pdf', '1909.05855.pdf', '1904.09678.pdf', '1711.11221.pdf', '1909.13695.pdf', '1909.06162.pdf', '2003.12218.pdf']","FLOAT SELECTED: Table 5: Performance of human evaluators and our classifiers (trained on all features), for Dataset-H as the test set",A Computational Approach to Automatic Prediction of Drunk Texting,"Alcohol abuse may lead to unsociable behavior such as crime, drunk driving,
or privacy leaks. We introduce automatic drunk-texting prediction as the task
of identifying whether a text was written when under the influence of alcohol.
We experiment with tweets labeled using hashtags as distant supervision. Our
classifiers use a set of N-gram and stylistic features to detect drunk tweets.
Our observations present the first quantitative evidence that text contains
signals that can be exploited to detect drunk-texting."
957bda6b421ef7d2839c3cec083404ac77721f14,1610.00879,What stylistic and structural features are outlined in the paper for detecting drunk-texting behavior?,"[{'answer': 'LDA unigrams (Presence/Count), POS Ratio, #Named Entity Mentions, #Discourse Connectors,  Spelling errors, Repeated characters, Capitalisation, Length,  Emoticon (Presence/Count ) \n and Sentiment Ratio', 'type': 'abstractive'}, {'answer': 'LDA unigrams (Presence/Count), POS Ratio, #Named Entity Mentions, #Discourse Connectors, Spelling errors, Repeated characters, Capitalization, Length, Emoticon (Presence/Count), Sentiment Ratio.', 'type': 'abstractive'}]",1610.00879.pdf,"['1610.00879.pdf', '1911.02821.pdf', '2004.04721.pdf', '1909.01247.pdf', '1909.00279.pdf', '1905.00563.pdf', '1909.03544.pdf', '1909.11467.pdf', '1902.00672.pdf', '1911.02711.pdf', '1611.00514.pdf', '1911.04952.pdf', '1611.04798.pdf', '1703.02507.pdf', '1911.07228.pdf', '2001.05493.pdf', '2002.06644.pdf']",FLOAT SELECTED: Table 1: Our Feature Set for Drunk-texting Prediction,A Computational Approach to Automatic Prediction of Drunk Texting,"Alcohol abuse may lead to unsociable behavior such as crime, drunk driving,
or privacy leaks. We introduce automatic drunk-texting prediction as the task
of identifying whether a text was written when under the influence of alcohol.
We experiment with tweets labeled using hashtags as distant supervision. Our
classifiers use a set of N-gram and stylistic features to detect drunk tweets.
Our observations present the first quantitative evidence that text contains
signals that can be exploited to detect drunk-texting."
8f87215f4709ee1eb9ddcc7900c6c054c970160b,1904.09678,"What metrics are used to evaluate the performance of UniSent in comparison to manually crafted lexica in Czech, German, French, Macedonian, and Spanish?","[{'answer': 'Accuracy and the macro-F1 (averaged F1 over positive and negative classes) are used as a measure of quality.', 'type': 'abstractive'}]",1904.09678.pdf,"['1904.09678.pdf', '1810.12196.pdf', '1901.02262.pdf', '1912.10011.pdf', '1804.08139.pdf', '1909.01013.pdf', '1909.13695.pdf']","FLOAT SELECTED: Table 1: Comparison of manually created lexicon performance with UniSent in Czech, German, French, Macedonians, and Spanish. We report accuracy and the macro-F1 (averaged F1 over positive and negative classes). The baseline is constantly considering the majority label. The last two columns indicate the performance of UniSent after drift weighting.",UniSent: Universal Adaptable Sentiment Lexica for 1000+ Languages,"In this paper, we introduce UniSent universal sentiment lexica for $1000+$
languages. Sentiment lexica are vital for sentiment analysis in absence of
document-level annotations, a very common scenario for low-resource languages.
To the best of our knowledge, UniSent is the largest sentiment resource to date
in terms of the number of covered languages, including many low resource ones.
In this work, we use a massively parallel Bible corpus to project sentiment
information from English to other languages for sentiment analysis on Twitter
data. We introduce a method called DomDrift to mitigate the huge domain
mismatch between Bible and Twitter by a confidence weighting scheme that uses
domain-specific embeddings to compare the nearest neighbors for a candidate
sentiment word in the source (Bible) and target (Twitter) domain. We evaluate
the quality of UniSent in a subset of languages for which manually created
ground truth was available, Macedonian, Czech, German, Spanish, and French. We
show that the quality of UniSent is comparable to manually created sentiment
resources when it is used as the sentiment seed for the task of word sentiment
prediction on top of embedding representations. In addition, we show that
emoticon sentiments could be reliably predicted in the Twitter domain using
only UniSent and monolingual embeddings in German, Spanish, French, and
Italian. With the publication of this paper, we release the UniSent sentiment
lexica."
572458399a45fd392c3a4e07ce26dcff2ad5a07d,1912.00864,"By how much do the BLEU-4 and ROUGE-L scores of the NAGM model outperform the best conventional models, Trans and CLSTM, on both the Oshiete-goo and nfL6 datasets, specifically in terms of exact numerical differences?","[{'answer': ""For the Oshiete-goo dataset, the NAGM model's ROUGE-L score is higher than the highest performing conventional model, Trans, by 0.021, and its BLEU-4 score is higher than the highest performing model CLSTM by 0.037.  For the nfL6 dataset, the NAGM model's ROUGE-L score is higher than the highest performing conventional model, CLSTM, by 0.028, and its BLEU-4 score is higher than the highest performing model CLSTM by 0.040. Human evaluation of the NAGM's generated outputs for the Oshiete-goo dataset had 47% ratings of (1), the highest rating, while CLSTM only received 21% ratings of (1). For the nfL6 dataset, the comparison of (1)'s was NAGM's 50% to CLSTM's 30%. "", 'type': 'abstractive'}]",1912.00864.pdf,"['1912.00864.pdf', '1811.02906.pdf', '1810.10254.pdf', '1804.07789.pdf', '1909.13375.pdf', '1910.11769.pdf', '1909.03544.pdf', '2001.06888.pdf', '1709.05413.pdf']","Finally, NAGM is consistently superior to the conventional attentive encoder-decoders regardless of the metric. Its ROUGE-L and BLEU-4 scores are much higher than those of CLSTM. ",Conclusion-Supplement Answer Generation for Non-Factoid Questions,"This paper tackles the goal of conclusion-supplement answer generation for
non-factoid questions, which is a critical issue in the field of Natural
Language Processing (NLP) and Artificial Intelligence (AI), as users often
require supplementary information before accepting a conclusion. The current
encoder-decoder framework, however, has difficulty generating such answers,
since it may become confused when it tries to learn several different long
answers to the same non-factoid question. Our solution, called an ensemble
network, goes beyond single short sentences and fuses logically connected
conclusion statements and supplementary statements. It extracts the context
from the conclusion decoder's output sequence and uses it to create
supplementary decoder states on the basis of an attention mechanism. It also
assesses the closeness of the question encoder's output sequence and the
separate outputs of the conclusion and supplement decoders as well as their
combination. As a result, it generates answers that match the questions and
have natural-sounding supplementary sequences in line with the context
expressed by the conclusion sequence. Evaluations conducted on datasets
including ""Love Advice"" and ""Arts & Humanities"" categories indicate that our
model outputs much more accurate results than the tested baseline models do."
9349acbfce95cb5d6b4d09ac626b55a9cb90e55e,1904.01608,"What are the distinct citation intent labels identified in both the ACL-ARC and SciCite datasets, and how do they differ in terms of their application and coverage?","[{'answer': 'Background, extends, uses, motivation, compare/contrast, and future work for the ACL-ARC dataset. Background, method, result comparison for the SciCite dataset.', 'type': 'abstractive'}]",1904.01608.pdf,"['1904.01608.pdf', '2003.05377.pdf', '1908.11365.pdf', '1912.13109.pdf', '1909.08859.pdf', '1810.12196.pdf', '1909.03544.pdf', '2002.06424.pdf', '1705.01214.pdf', '1809.00530.pdf', '1901.02262.pdf', '1911.07555.pdf', '2002.06675.pdf', '1603.04513.pdf', '1711.00106.pdf', '2001.00137.pdf']",FLOAT SELECTED: Table 2: Characteristics of SciCite compared with ACL-ARC dataset by Jurgens et al. (2018),Structural Scaffolds for Citation Intent Classification in Scientific Publications,"Identifying the intent of a citation in scientific papers (e.g., background
information, use of methods, comparing results) is critical for machine reading
of individual publications and automated analysis of the scientific literature.
We propose structural scaffolds, a multitask model to incorporate structural
information of scientific papers into citations for effective classification of
citation intents. Our model achieves a new state-of-the-art on an existing ACL
anthology dataset (ACL-ARC) with a 13.3% absolute increase in F1 score, without
relying on external linguistic resources or hand-engineered features as done in
existing methods. In addition, we introduce a new dataset of citation intents
(SciCite) which is more than five times larger and covers multiple scientific
domains compared with existing datasets. Our code and data are available at:
https://github.com/allenai/scicite."
b634ff1607ce5756655e61b9a6f18bc736f84c83,1812.10479,"According to the results of the study investigating the effects of combining news and price data for short-term stock volatility prediction, which stock market sector achieved the highest accuracy in volatility forecasting?","[{'answer': 'Energy with accuracy of 0.538', 'type': 'abstractive'}, {'answer': 'Energy', 'type': 'abstractive'}]",1812.10479.pdf,"['1812.10479.pdf', '1909.13695.pdf', '2003.12218.pdf', '1904.09678.pdf', '1901.09755.pdf', '1909.00015.pdf', '1806.07711.pdf', '1909.09587.pdf', '1909.03544.pdf', '2003.07723.pdf', '1909.05855.pdf', '1911.02821.pdf', '1810.05241.pdf', '1901.08079.pdf', '1910.14497.pdf', '2001.00137.pdf', '1911.08673.pdf']",FLOAT SELECTED: Table 8: Sector-level performance comparison.,Multimodal deep learning for short-term stock volatility prediction,"Stock market volatility forecasting is a task relevant to assessing market
risk. We investigate the interaction between news and prices for the
one-day-ahead volatility prediction using state-of-the-art deep learning
approaches. The proposed models are trained either end-to-end or using sentence
encoders transfered from other tasks. We evaluate a broad range of stock market
sectors, namely Consumer Staples, Energy, Utilities, Heathcare, and Financials.
Our experimental results show that adding news improves the volatility
forecasting as compared to the mainstream models that rely only on price data.
In particular, our model outperforms the widely-recognized GARCH(1,1) model for
all sectors in terms of coefficient of determination $R^2$, $MSE$ and $MAE$,
achieving the best performance when training from both news and price data."
5fa36dc8f7c4e65acb962fc484989d20b8fdaeec,1901.08079,"Does the paper focus on datasets from the medical domain, without including general-purpose English datasets?","[{'answer': 'Yes', 'type': 'boolean'}]",1901.08079.pdf,"['1901.08079.pdf', '1910.00458.pdf', '1810.06743.pdf', '1707.03569.pdf', '1909.00512.pdf', '1907.03060.pdf', '2004.04721.pdf', '1908.06267.pdf', '1801.05147.pdf', '1909.02480.pdf', '2002.06675.pdf']",FLOAT SELECTED: Table 1: Description of training and test datasets.,A Question-Entailment Approach to Question Answering,"One of the challenges in large-scale information retrieval (IR) is to develop
fine-grained and domain-specific methods to answer natural language questions.
Despite the availability of numerous sources and datasets for answer retrieval,
Question Answering (QA) remains a challenging problem due to the difficulty of
the question understanding and answer extraction tasks. One of the promising
tracks investigated in QA is to map new questions to formerly answered
questions that are `similar'. In this paper, we propose a novel QA approach
based on Recognizing Question Entailment (RQE) and we describe the QA system
and resources that we built and evaluated on real medical questions. First, we
compare machine learning and deep learning methods for RQE using different
kinds of datasets, including textual inference, question similarity and
entailment in both the open and clinical domains. Second, we combine IR models
with the best RQE method to select entailed questions and rank the retrieved
answers. To study the end-to-end QA approach, we built the MedQuAD collection
of 47,457 question-answer pairs from trusted medical sources, that we introduce
and share in the scope of this paper. Following the evaluation process used in
TREC 2017 LiveQA, we find that our approach exceeds the best results of the
medical task with a 29.8% increase over the best official score. The evaluation
results also support the relevance of question entailment for QA and highlight
the effectiveness of combining IR and RQE for future QA efforts. Our findings
also show that relying on a restricted set of reliable answer sources can bring
a substantial improvement in medical QA."
