q_id,doc_id,question,answer,doc_path,documents,evidence,title,abstract
4cbe5a36b492b99f9f9fea8081fe4ba10a7a0e94,1809.01202,What baseline approaches using state-of-the-art PDTB taggers were employed for the evaluation of causality prediction in the automatic causal explanation analysis pipeline?,"[{'answer': 'state-of-the-art PDTB taggers', 'type': 'extractive'}, {'answer': 'Linear SVM, RBF SVM, and Random Forest', 'type': 'abstractive'}]",1809.01202.pdf,"['1809.01202.pdf', '1908.06083.pdf', '2002.01984.pdf', '1809.03449.pdf', '2002.06675.pdf', '2002.01207.pdf', '1912.01772.pdf', '1809.02279.pdf', '1904.05584.pdf', '1704.05907.pdf', '1910.14497.pdf', '1903.00172.pdf', '1911.05153.pdf', '1901.04899.pdf']","We first use state-of-the-art PDTB taggers for our baseline BIBREF13 , BIBREF12 for the evaluation of the causality prediction of our models ( BIBREF12 requires sentences extracted from the text as its input, so we used our parser to extract sentences from the message).",Causal Explanation Analysis on Social Media,"Understanding causal explanations - reasons given for happenings in one's
life - has been found to be an important psychological factor linked to
physical and mental health. Causal explanations are often studied through
manual identification of phrases over limited samples of personal writing.
Automatic identification of causal explanations in social media, while
challenging in relying on contextual and sequential cues, offers a larger-scale
alternative to expensive manual ratings and opens the door for new applications
(e.g. studying prevailing beliefs about causes, such as climate change). Here,
we explore automating causal explanation analysis, building on discourse
parsing, and presenting two novel subtasks: causality detection (determining
whether a causal explanation exists at all) and causal explanation
identification (identifying the specific phrase that is the explanation). We
achieve strong accuracies for both tasks but find different approaches best: an
SVM for causality prediction (F1 = 0.791) and a hierarchy of Bidirectional
LSTMs for causal explanation identification (F1 = 0.853). Finally, we explore
applications of our complete pipeline (F1 = 0.868), showing demographic
differences in mentions of causal explanation and that the association between
a word and sentiment can change when it is used within a causal explanation."
ed7a3e7fc1672f85a768613e7d1b419475950ab4,1909.00754,"Based on the joint goal accuracy and inference time complexity, does the model demonstrate superior performance in the single-domain WoZ2.0 test set or the multi-domain MultiWoZ test set?","[{'answer': 'single-domain setting', 'type': 'abstractive'}]",1909.00754.pdf,"['1909.00754.pdf', '1710.09340.pdf', '2004.01980.pdf', '1910.12129.pdf', '1701.06538.pdf', '1811.12254.pdf', '1902.10525.pdf']","FLOAT SELECTED: Table 3: The joint goal accuracy of the DST models on the WoZ2.0 test set and the MultiWoZ test set. We also include the Inference Time Complexity (ITC) for each model as a metric for scalability. The baseline accuracy for the WoZ2.0 dataset is the Delexicalisation-Based (DB) Model (Mrksic et al., 2017), while the baseline for the MultiWoZ dataset is taken from the official website of MultiWoZ (Budzianowski et al., 2018).",Scalable and Accurate Dialogue State Tracking via Hierarchical Sequence Generation,"Existing approaches to dialogue state tracking rely on pre-defined ontologies
consisting of a set of all possible slot types and values. Though such
approaches exhibit promising performance on single-domain benchmarks, they
suffer from computational complexity that increases proportionally to the
number of pre-defined slots that need tracking. This issue becomes more severe
when it comes to multi-domain dialogues which include larger numbers of slots.
In this paper, we investigate how to approach DST using a generation framework
without the pre-defined ontology list. Given each turn of user utterance and
system response, we directly generate a sequence of belief states by applying a
hierarchical encoder-decoder structure. In this way, the computational
complexity of our model will be a constant regardless of the number of
pre-defined slots. Experiments on both the multi-domain and the single domain
dialogue state tracking dataset show that our model not only scales easily with
the increasing number of pre-defined domains and slots but also reaches the
state-of-the-art performance."
664db503509b8236bc4d3dc39cebb74498365750,1912.10011,Which hierarchical model variant achieves a higher BLEU score of 17.5 compared to the Flat scenario (16.7)?,"[{'answer': 'Hierarchical-k', 'type': 'extractive'}]",1912.10011.pdf,"['1912.10011.pdf', '1809.08298.pdf', '1810.12085.pdf', '1905.11901.pdf', '1908.10084.pdf', '2001.08051.pdf', '1909.08041.pdf', '1910.14497.pdf', '1909.08859.pdf', '2004.04721.pdf', '1809.00540.pdf', '1909.11297.pdf', '1610.00879.pdf', '2002.02070.pdf', '2002.01359.pdf', '1811.02906.pdf']","To evaluate the impact of our model components, we first compare scenarios Flat, Hierarchical-k, and Hierarchical-kv. As shown in Table TABREF25, we can see the lower results obtained by the Flat scenario compared to the other scenarios (e.g. BLEU $16.7$ vs. $17.5$ for resp. Flat and Hierarchical-k), suggesting the effectiveness of encoding the data-structure using a hierarchy.",A Hierarchical Model for Data-to-Text Generation,"Transcribing structured data into natural language descriptions has emerged
as a challenging task, referred to as ""data-to-text"". These structures
generally regroup multiple elements, as well as their attributes. Most attempts
rely on translation encoder-decoder methods which linearize elements into a
sequence. This however loses most of the structure contained in the data. In
this work, we propose to overpass this limitation with a hierarchical model
that encodes the data-structure at the element-level and the structure level.
Evaluations on RotoWire show the effectiveness of our model w.r.t. qualitative
and quantitative metrics."
1a8b7d3d126935c09306cacca7ddb4b953ef68ab,1707.08559,"What were the F-scores of the best performing model on the NALCS (English) and LMS (Traditional Chinese) test sets, as reported in the video highlight prediction paper using multimodal and multilingual audience chat reactions?","[{'answer': 'Best model achieved F-score 74.7 on NALCS and F-score of 70.0 on LMS on test set', 'type': 'abstractive'}]",1707.08559.pdf,"['1707.08559.pdf', '1909.03135.pdf', '2003.11563.pdf', '1707.05236.pdf', '1906.05474.pdf', '2002.01664.pdf', '1901.08079.pdf', '2002.08899.pdf', '1904.05584.pdf', '1810.12085.pdf', '1712.00991.pdf', '1901.05280.pdf', '1709.05413.pdf', '1901.02262.pdf', '1701.06538.pdf', '1909.00252.pdf', '1707.03569.pdf', '1912.01772.pdf']",FLOAT SELECTED: Table 3: Test Results on the NALCS (English) and LMS (Traditional Chinese) datasets.,Video Highlight Prediction Using Audience Chat Reactions,"Sports channel video portals offer an exciting domain for research on
multimodal, multilingual analysis. We present methods addressing the problem of
automatic video highlight prediction based on joint visual features and textual
analysis of the real-world audience discourse with complex slang, in both
English and traditional Chinese. We present a novel dataset based on League of
Legends championships recorded from North American and Taiwanese Twitch.tv
channels (will be released for further research), and demonstrate strong
results on these using multimodal, character-level CNN-RNN model architectures."
281cd4e78b27a62713ec43249df5000812522a89,1906.03538,What is the average token count of claims in the PERSPECTRUM dataset?,"[{'answer': 'Average claim length is 8.9 tokens.', 'type': 'abstractive'}]",1906.03538.pdf,"['1906.03538.pdf', '1705.00108.pdf', '1901.09755.pdf', '1908.05828.pdf', '2001.08051.pdf', '1705.01214.pdf', '1909.08089.pdf', '2002.08899.pdf']",FLOAT SELECTED: Table 2: A summary of PERSPECTRUM statistics,Seeing Things from a Different Angle: Discovering Diverse Perspectives about Claims,"One key consequence of the information revolution is a significant increase
and a contamination of our information supply. The practice of fact checking
won't suffice to eliminate the biases in text data we observe, as the degree of
factuality alone does not determine whether biases exist in the spectrum of
opinions visible to us. To better understand controversial issues, one needs to
view them from a diverse yet comprehensive set of perspectives. For example,
there are many ways to respond to a claim such as ""animals should have lawful
rights"", and these responses form a spectrum of perspectives, each with a
stance relative to this claim and, ideally, with evidence supporting it.
Inherently, this is a natural language understanding task, and we propose to
address it as such. Specifically, we propose the task of substantiated
perspective discovery where, given a claim, a system is expected to discover a
diverse set of well-corroborated perspectives that take a stance with respect
to the claim. Each perspective should be substantiated by evidence paragraphs
which summarize pertinent results and facts. We construct PERSPECTRUM, a
dataset of claims, perspectives and evidence, making use of online debate
websites to create the initial data collection, and augmenting it using search
engines in order to expand and diversify our dataset. We use crowd-sourcing to
filter out noise and ensure high-quality data. Our dataset contains 1k claims,
accompanied with pools of 10k and 8k perspective sentences and evidence
paragraphs, respectively. We provide a thorough analysis of the dataset to
highlight key underlying language understanding challenges, and show that human
baselines across multiple subtasks far outperform ma-chine baselines built upon
state-of-the-art NLP techniques. This poses a challenge and opportunity for the
NLP community to address."
f2155dc4aeab86bf31a838c8ff388c85440fce6e,1908.11047,Does incorporating shallow syntax-aware embeddings lead to better performance on the sentiment classification task compared to using standard ELMo embeddings?,"[{'answer': 'Yes', 'type': 'boolean'}, {'answer': 'No', 'type': 'boolean'}]",1908.11047.pdf,"['1908.11047.pdf', '1910.03467.pdf', '1703.06492.pdf', '1810.12885.pdf', '1906.11180.pdf', '1809.10644.pdf']","Results are shown in Table TABREF12. Consistent with previous findings, cwrs offer large improvements across all tasks.",Shallow Syntax in Deep Water,"Shallow syntax provides an approximation of phrase-syntactic structure of
sentences; it can be produced with high accuracy, and is computationally cheap
to obtain. We investigate the role of shallow syntax-aware representations for
NLP tasks using two techniques. First, we enhance the ELMo architecture to
allow pretraining on predicted shallow syntactic parses, instead of just raw
text, so that contextual embeddings make use of shallow syntactic context. Our
second method involves shallow syntactic features obtained automatically on
downstream task data. Neither approach leads to a significant gain on any of
the four downstream tasks we considered relative to ELMo-only baselines.
Further analysis using black-box probes confirms that our shallow-syntax-aware
contextual embeddings do not transfer to linguistic tasks any more easily than
ELMo's embeddings. We take these findings as evidence that ELMo-style
pretraining discovers representations which make additional awareness of
shallow syntax redundant."
ed6a15f0f7fa4594e51d5bde21cc0c6c1bedbfdc,1908.11047,"Out of the 9 probe tasks, how many tasks show better performance with the mSynC model compared to baseline ELMo-transformer embeddings in the ""Shallow Syntax in Deep Water"" study?","[{'answer': 'performance of baseline ELMo-transformer and mSynC are similar, with mSynC doing slightly worse on 7 out of 9 tasks', 'type': 'extractive'}, {'answer': '3', 'type': 'abstractive'}]",1908.11047.pdf,"['1908.11047.pdf', '2003.11645.pdf', '1906.01081.pdf', '1904.10500.pdf', '1911.08673.pdf', '1907.09369.pdf']","Results in Table TABREF13 show ten probes. Again, we see the performance of baseline ELMo-transformer and mSynC are similar, with mSynC doing slightly worse on 7 out of 9 tasks.",Shallow Syntax in Deep Water,"Shallow syntax provides an approximation of phrase-syntactic structure of
sentences; it can be produced with high accuracy, and is computationally cheap
to obtain. We investigate the role of shallow syntax-aware representations for
NLP tasks using two techniques. First, we enhance the ELMo architecture to
allow pretraining on predicted shallow syntactic parses, instead of just raw
text, so that contextual embeddings make use of shallow syntactic context. Our
second method involves shallow syntactic features obtained automatically on
downstream task data. Neither approach leads to a significant gain on any of
the four downstream tasks we considered relative to ELMo-only baselines.
Further analysis using black-box probes confirms that our shallow-syntax-aware
contextual embeddings do not transfer to linguistic tasks any more easily than
ELMo's embeddings. We take these findings as evidence that ELMo-style
pretraining discovers representations which make additional awareness of
shallow syntax redundant."
4d706ce5bde82caf40241f5b78338ea5ee5eb01e,1908.11047,"What specific set of black-box probes, as described in the evidence section of this paper, were used to analyze the role of shallow syntactic awareness in the enhanced ELMo architecture's embeddings for capturing linguistic properties?","[{'answer': 'CCG Supertagging CCGBank , PTB part-of-speech tagging, EWT part-of-speech tagging,\nChunking, Named Entity Recognition, Semantic Tagging, Grammar Error Detection, Preposition Supersense Role, Preposition Supersense Function, Event Factuality Detection', 'type': 'abstractive'}, {'answer': 'Probes are linear models trained on frozen cwrs to make predictions about linguistic (syntactic and semantic) properties of words and phrases.', 'type': 'extractive'}]",1908.11047.pdf,"['1908.11047.pdf', '2001.10161.pdf', '1911.11951.pdf', '1911.01799.pdf', '1908.07816.pdf', '1811.02906.pdf', '1809.02279.pdf', '1904.10500.pdf', '1910.10288.pdf']"," We further examine the contextual embeddings obtained from the enhanced architecture and a shallow syntactic context, using black-box probes from BIBREF1",Shallow Syntax in Deep Water,"Shallow syntax provides an approximation of phrase-syntactic structure of
sentences; it can be produced with high accuracy, and is computationally cheap
to obtain. We investigate the role of shallow syntax-aware representations for
NLP tasks using two techniques. First, we enhance the ELMo architecture to
allow pretraining on predicted shallow syntactic parses, instead of just raw
text, so that contextual embeddings make use of shallow syntactic context. Our
second method involves shallow syntactic features obtained automatically on
downstream task data. Neither approach leads to a significant gain on any of
the four downstream tasks we considered relative to ELMo-only baselines.
Further analysis using black-box probes confirms that our shallow-syntax-aware
contextual embeddings do not transfer to linguistic tasks any more easily than
ELMo's embeddings. We take these findings as evidence that ELMo-style
pretraining discovers representations which make additional awareness of
shallow syntax redundant."
86bf75245358f17e35fc133e46a92439ac86d472,1908.11047,"Based on the findings in *Shallow Syntax in Deep Water*, how does mSynC's performance on downstream NLP tasks, especially in chunk tag prediction, compare to that of ELMo-transformer, and what does this imply about the utility of shallow syntactic features?","[{'answer': 'only modest gains on three of the four downstream tasks', 'type': 'extractive'}, {'answer': ' the performance differences across all tasks are small enough ', 'type': 'extractive'}]",1908.11047.pdf,"['1908.11047.pdf', '1711.11221.pdf', '1611.03382.pdf', '1709.10367.pdf', '1910.00458.pdf', '1701.02877.pdf', '1911.02086.pdf', '1909.09484.pdf']","Results in Table TABREF13 show ten probes. Again, we see the performance of baseline ELMo-transformer and mSynC are similar, with mSynC doing slightly worse on 7 out of 9 tasks. As we would expect, on the probe for predicting chunk tags, mSynC achieves 96.9 $F_1$ vs. 92.2 $F_1$ for ELMo-transformer, indicating that mSynC is indeed encoding shallow syntax. Overall, the results further confirm that explicit shallow syntax does not offer any benefits over ELMo-transformer.",Shallow Syntax in Deep Water,"Shallow syntax provides an approximation of phrase-syntactic structure of
sentences; it can be produced with high accuracy, and is computationally cheap
to obtain. We investigate the role of shallow syntax-aware representations for
NLP tasks using two techniques. First, we enhance the ELMo architecture to
allow pretraining on predicted shallow syntactic parses, instead of just raw
text, so that contextual embeddings make use of shallow syntactic context. Our
second method involves shallow syntactic features obtained automatically on
downstream task data. Neither approach leads to a significant gain on any of
the four downstream tasks we considered relative to ELMo-only baselines.
Further analysis using black-box probes confirms that our shallow-syntax-aware
contextual embeddings do not transfer to linguistic tasks any more easily than
ELMo's embeddings. We take these findings as evidence that ELMo-style
pretraining discovers representations which make additional awareness of
shallow syntax redundant."
9ebb2adf92a0f8db99efddcade02a20a219ca7d9,2001.08051,"How were the six predefined proficiency indicators scored in the 2017/2018 recordings of the TLT-school corpus for both spoken and written items, and what values did human experts assign to reflect proficiency levels?","[{'answer': 'They used 6 indicators for proficiency (same for written and spoken) each marked by bad, medium or good by one expert.', 'type': 'abstractive'}]",2001.08051.pdf,"['2001.08051.pdf', '1909.08041.pdf', '1901.02257.pdf', '1912.10435.pdf', '1910.06748.pdf', '1909.00754.pdf', '2001.10161.pdf', '1903.00172.pdf', '1712.03547.pdf', '1904.10503.pdf', '1804.07789.pdf', '2003.04866.pdf', '1901.03866.pdf', '1909.08824.pdf', '1902.00672.pdf', '2002.01664.pdf', '1902.00330.pdf', '1908.05828.pdf']","Each written or spoken item received a total score by human experts, computed by summing up the scores related to 6 indicators in 2017/2018 (from 3 to 6 in the 2016 campaign, according to the proficiency levels and the type of test). Each indicator can assume a value 0, 1, 2, corresponding to bad, medium, good, respectively.",TLT-school: a Corpus of Non Native Children Speech,"This paper describes ""TLT-school"" a corpus of speech utterances collected in
schools of northern Italy for assessing the performance of students learning
both English and German. The corpus was recorded in the years 2017 and 2018
from students aged between nine and sixteen years, attending primary, middle
and high school. All utterances have been scored, in terms of some predefined
proficiency indicators, by human experts. In addition, most of utterances
recorded in 2017 have been manually transcribed carefully. Guidelines and
procedures used for manual transcriptions of utterances will be described in
detail, as well as results achieved by means of an automatic speech recognition
system developed by us. Part of the corpus is going to be freely distributed to
scientific community particularly interested both in non-native speech
recognition and automatic assessment of second language proficiency."
973f6284664675654cc9881745880a0e88f3280e,2001.08051,What are the six linguistic proficiency indicators outlined in the TLT-school corpus that human experts used to assess the English and German utterances of non-native speaking students?,"[{'answer': '6 indicators:\n- lexical richness\n- pronunciation and fluency\n- syntactical correctness\n- fulfillment of delivery\n- coherence and cohesion\n- communicative, descriptive, narrative skills', 'type': 'abstractive'}]",2001.08051.pdf,"['2001.08051.pdf', '1901.05280.pdf', '1712.03547.pdf', '1809.00540.pdf', '1910.12795.pdf', '1603.00968.pdf', '2001.05970.pdf', '1910.04269.pdf', '1806.04330.pdf', '2002.02492.pdf', '1908.08345.pdf', '1901.04899.pdf', '1811.12254.pdf', '1909.13695.pdf', '1804.08050.pdf']",FLOAT SELECTED: Table 4: List of the indicators used by human experts to evaluate specific linguistic competences.,TLT-school: a Corpus of Non Native Children Speech,"This paper describes ""TLT-school"" a corpus of speech utterances collected in
schools of northern Italy for assessing the performance of students learning
both English and German. The corpus was recorded in the years 2017 and 2018
from students aged between nine and sixteen years, attending primary, middle
and high school. All utterances have been scored, in terms of some predefined
proficiency indicators, by human experts. In addition, most of utterances
recorded in 2017 have been manually transcribed carefully. Guidelines and
procedures used for manual transcriptions of utterances will be described in
detail, as well as results achieved by means of an automatic speech recognition
system developed by us. Part of the corpus is going to be freely distributed to
scientific community particularly interested both in non-native speech
recognition and automatic assessment of second language proficiency."
0a3a8d1b0cbac559f7de845d845ebbfefb91135e,2001.08051,What are the Word Error Rates (WER) achieved by the adapted Automatic Speech Recognition (ASR) system on the non-native English and German children's speech evaluation data in the TLT-school corpus?,"[{'answer': 'Accuracy not available: WER results are reported 42.6 German, 35.9 English', 'type': 'abstractive'}]",2001.08051.pdf,"['2001.08051.pdf', '1804.08139.pdf', '1909.08041.pdf', '1809.09194.pdf', '1804.08050.pdf', '1701.00185.pdf']","Table , extracted from BIBREF0, reports WERs obtained on evaluation data sets with a strongly adapted ASR, demonstrating the difficulty of the related speech recognition task for both languages.",TLT-school: a Corpus of Non Native Children Speech,"This paper describes ""TLT-school"" a corpus of speech utterances collected in
schools of northern Italy for assessing the performance of students learning
both English and German. The corpus was recorded in the years 2017 and 2018
from students aged between nine and sixteen years, attending primary, middle
and high school. All utterances have been scored, in terms of some predefined
proficiency indicators, by human experts. In addition, most of utterances
recorded in 2017 have been manually transcribed carefully. Guidelines and
procedures used for manual transcriptions of utterances will be described in
detail, as well as results achieved by means of an automatic speech recognition
system developed by us. Part of the corpus is going to be freely distributed to
scientific community particularly interested both in non-native speech
recognition and automatic assessment of second language proficiency."
ec2b8c43f14227cf74f9b49573cceb137dd336e7,2001.08051,What metric is used to evaluate the performance of the adapted ASR system on non-native children's English and German speech?,"[{'answer': 'Speech recognition system is evaluated using WER metric.', 'type': 'abstractive'}]",2001.08051.pdf,"['2001.08051.pdf', '1910.06036.pdf', '2004.01878.pdf', '2004.01980.pdf', '1908.05434.pdf', '1911.12579.pdf', '1911.08962.pdf', '1901.09755.pdf', '1610.07809.pdf', '1709.10217.pdf', '1910.03814.pdf', '1902.09393.pdf', '1909.01013.pdf', '1812.10479.pdf', '1704.05907.pdf', '1710.06700.pdf', '2001.10161.pdf']","Table , extracted from BIBREF0, reports WERs obtained on evaluation data sets with a strongly adapted ASR, demonstrating the difficulty of the related speech recognition task for both languages.",TLT-school: a Corpus of Non Native Children Speech,"This paper describes ""TLT-school"" a corpus of speech utterances collected in
schools of northern Italy for assessing the performance of students learning
both English and German. The corpus was recorded in the years 2017 and 2018
from students aged between nine and sixteen years, attending primary, middle
and high school. All utterances have been scored, in terms of some predefined
proficiency indicators, by human experts. In addition, most of utterances
recorded in 2017 have been manually transcribed carefully. Guidelines and
procedures used for manual transcriptions of utterances will be described in
detail, as well as results achieved by means of an automatic speech recognition
system developed by us. Part of the corpus is going to be freely distributed to
scientific community particularly interested both in non-native speech
recognition and automatic assessment of second language proficiency."
