q_id,doc_id,question,answer,doc_path,documents,evidence,title,abstract
35b3ce3a7499070e9b280f52e2cb0c29b0745380,2003.08385,"Does the paper list the macro-average F1 scores for the 'favor' and 'against' classes in a zero-shot cross-lingual stance detection setting involving German, French, and Italian languages?","[{'answer': 'Yes', 'type': 'boolean'}, {'answer': 'Yes', 'type': 'boolean'}]",2003.08385.pdf,"['2003.08385.pdf', '1605.08675.pdf', '1909.03405.pdf', '1908.06267.pdf', '1902.00672.pdf', '1908.07195.pdf', '2002.06675.pdf', '1909.01383.pdf', '2003.03014.pdf']","FLOAT SELECTED: Table 3: Baseline scores in the cross-lingual setting. No Italian samples were seen during training, making this a case of zero-shot cross-lingual transfer. The scores are reported as the macro-average of the F1scores for â€˜favorâ€™ and for â€˜againstâ€™.",X-Stance: A Multilingual Multi-Target Dataset for Stance Detection,"We extract a large-scale stance detection dataset from comments written by
candidates of elections in Switzerland. The dataset consists of German, French
and Italian text, allowing for a cross-lingual evaluation of stance detection.
It contains 67 000 comments on more than 150 political issues (targets). Unlike
stance detection models that have specific target issues, we use the dataset to
train a single model on all the issues. To make learning across targets
possible, we prepend to each instance a natural question that represents the
target (e.g. ""Do you support X?""). Baseline results from multilingual BERT show
that zero-shot cross-lingual and cross-target transfer of stance detection is
moderately successful with this approach."
71ba1b09bb03f5977d790d91702481cc406b3767,2003.08385,What F1 macro score and accuracy did M-BERT achieve on the supervised stance detection benchmarks in the X-Stance paper?,"[{'answer': 'M-Bert had 76.6 F1 macro score.', 'type': 'abstractive'}, {'answer': '75.1% and 75.6% accuracy', 'type': 'abstractive'}]",2003.08385.pdf,"['2003.08385.pdf', '2002.10361.pdf', '1809.01541.pdf', '1708.09609.pdf', '1910.00912.pdf', '1701.03214.pdf', '1810.12085.pdf', '1810.12196.pdf', '1912.01772.pdf', '2001.08868.pdf', '2003.04642.pdf', '1709.05413.pdf', '1910.03467.pdf', '2002.02070.pdf', '1808.03430.pdf']",FLOAT SELECTED: Table 6: Performance of BERT-like models on different supervised stance detection benchmarks.,X-Stance: A Multilingual Multi-Target Dataset for Stance Detection,"We extract a large-scale stance detection dataset from comments written by
candidates of elections in Switzerland. The dataset consists of German, French
and Italian text, allowing for a cross-lingual evaluation of stance detection.
It contains 67 000 comments on more than 150 political issues (targets). Unlike
stance detection models that have specific target issues, we use the dataset to
train a single model on all the issues. To make learning across targets
possible, we prepend to each instance a natural question that represents the
target (e.g. ""Do you support X?""). Baseline results from multilingual BERT show
that zero-shot cross-lingual and cross-target transfer of stance detection is
moderately successful with this approach."
bd40f33452da7711b65faaa248aca359b27fddb6,2003.08385,What was the F1 macro score that multilingual BERT achieved on the Swiss election comments dataset for multilingual multi-target stance detection detailed in the X-Stance paper?,"[{'answer': 'BERT had 76.6 F1 macro score on x-stance dataset.', 'type': 'abstractive'}]",2003.08385.pdf,"['2003.08385.pdf', '2002.01359.pdf', '2003.06044.pdf', '1910.12795.pdf', '1912.10011.pdf', '1904.01608.pdf', '1804.08050.pdf', '1804.11346.pdf', '1805.03710.pdf', '2001.06888.pdf', '1806.04330.pdf']",To put the supervised score into context we list scores that variants of Bert have achieved on other stance detection datasets in Table TABREF46.,X-Stance: A Multilingual Multi-Target Dataset for Stance Detection,"We extract a large-scale stance detection dataset from comments written by
candidates of elections in Switzerland. The dataset consists of German, French
and Italian text, allowing for a cross-lingual evaluation of stance detection.
It contains 67 000 comments on more than 150 political issues (targets). Unlike
stance detection models that have specific target issues, we use the dataset to
train a single model on all the issues. To make learning across targets
possible, we prepend to each instance a natural question that represents the
target (e.g. ""Do you support X?""). Baseline results from multilingual BERT show
that zero-shot cross-lingual and cross-target transfer of stance detection is
moderately successful with this approach."
3288a50701a80303fd71c8c5ede81cbee14fa2c7,1908.11365,Does the model with DS-Init and MAtt have fewer parameters than the baseline Transformer for the WMT14 En-De translation task?,"[{'answer': 'No', 'type': 'boolean'}]",1908.11365.pdf,"['1908.11365.pdf', '1603.00968.pdf', '1808.09920.pdf', '1910.14497.pdf', '1910.06592.pdf', '1901.09755.pdf']",FLOAT SELECTED: Table 3: Tokenized case-sensitive BLEU (in parentheses: sacreBLEU) on WMT14 En-De translation task. #Param: number of model parameters. 4Dec: decoding time (seconds)/speedup on newstest2014 dataset with a batch size of 32. 4Train: training time (seconds)/speedup per training step evaluated on 0.5K steps with a batch size of 1K target tokens. Time is averaged over 3 runs using Tensorflow on a single TITAN X (Pascal). â€œ-â€: optimization failed and no result. â€œ?â€: the same as model 1Â©. â€  and â€¡: comparison against 11Â© and 14Â© respectively rather than 1Â©. Base: the baseline Transformer with base setting. Bold indicates best BLEU score. dpa and dpr: dropout rate on attention weights and residual connection. bs: batch size in tokens.,Improving Deep Transformer with Depth-Scaled Initialization and Merged Attention,"The general trend in NLP is towards increasing model capacity and performance
via deeper neural networks. However, simply stacking more layers of the popular
Transformer architecture for machine translation results in poor convergence
and high computational overhead. Our empirical analysis suggests that
convergence is poor due to gradient vanishing caused by the interaction between
residual connections and layer normalization. We propose depth-scaled
initialization (DS-Init), which decreases parameter variance at the
initialization stage, and reduces output variance of residual connections so as
to ease gradient back-propagation through normalization layers. To address
computational cost, we propose a merged attention sublayer (MAtt) which
combines a simplified averagebased self-attention sublayer and the
encoderdecoder attention sublayer on the decoder side. Results on WMT and IWSLT
translation tasks with five translation directions show that deep Transformers
with DS-Init and MAtt can substantially outperform their base counterpart in
terms of BLEU (+1.1 BLEU on average for 12-layer models), while matching the
decoding speed of the baseline model thanks to the efficiency improvements of
MAtt."
96c09ece36a992762860cde4c110f1653c110d96,1709.10217,"Based on the evaluation results, what were the highest F1 scores for Task 1 and the top performance metrics for Task 2, including Ratio, Satisfaction, Fluency, Turns, and Guide, in the iFLYTEK Corporation's evaluation of Chinese human-computer dialogue technology?","[{'answer': 'For task 1 best F1 score was 0.9391 on closed and 0.9414 on open test.\nFor task2 best result had: Ratio 0.3175 , Satisfaction 64.53, Fluency 0, Turns -1 and Guide 2', 'type': 'abstractive'}]",1709.10217.pdf,"['1709.10217.pdf', '1909.08041.pdf', '1909.00754.pdf', '1909.02480.pdf', '1909.00015.pdf', '1909.03135.pdf']",Table TABREF14 and TABREF15 show the evaluation results of the closed test and open test of the task 1 respectively.,The First Evaluation of Chinese Human-Computer Dialogue Technology,"In this paper, we introduce the first evaluation of Chinese human-computer
dialogue technology. We detail the evaluation scheme, tasks, metrics and how to
collect and annotate the data for training, developing and test. The evaluation
includes two tasks, namely user intent classification and online testing of
task-oriented dialogue. To consider the different sources of the data for
training and developing, the first task can also be divided into two sub tasks.
Both the two tasks are coming from the real problems when using the
applications developed by industry. The evaluation data is provided by the
iFLYTEK Corporation. Meanwhile, in this paper, we publish the evaluation
results to present the current performance of the participants in the two tasks
of Chinese human-computer dialogue technology. Moreover, we analyze the
existing problems of human-computer dialogue as well as the evaluation scheme
itself."
a5b67470a1c4779877f0d8b7724879bbb0a3b313,1705.00108,What is the micro-averaged evaluation metric officially reported in the results for assessing the performance of the semi-supervised bidirectional language model on named entity recognition and chunking tasks?,"[{'answer': 'micro-averaged F1', 'type': 'abstractive'}]",1705.00108.pdf,"['1705.00108.pdf', '1909.03405.pdf', '1812.06864.pdf', '1809.05752.pdf', '2004.03744.pdf', '2001.05493.pdf', '1908.11365.pdf', '1709.10217.pdf', '1911.05153.pdf']",We report the official evaluation metric (micro-averaged INLINEFORM0 ). ,Semi-supervised sequence tagging with bidirectional language models,"Pre-trained word embeddings learned from unlabeled text have become a
standard component of neural network architectures for NLP tasks. However, in
most cases, the recurrent network that operates on word-level representations
to produce context sensitive representations is trained on relatively little
labeled data. In this paper, we demonstrate a general semi-supervised approach
for adding pre- trained context embeddings from bidirectional language models
to NLP systems and apply it to sequence labeling tasks. We evaluate our model
on two standard datasets for named entity recognition (NER) and chunking, and
in both cases achieve state of the art results, surpassing previous systems
that use other forms of transfer or joint learning with additional labeled data
and task specific gazetteers."
4640793d82aa7db30ad7b88c0bf0a1030e636558,1705.00108,"In the comparison of sequence tagging models without incorporating additional labeled data or task-specific gazetteers, which systems are listed in the semi-supervised sequence tagging with bidirectional language models paper?","[{'answer': 'Chiu and Nichols (2016), Lample et al. (2016), Ma and Hovy (2016), Yang et al. (2017), Hashimoto et al. (2016), SÃ¸gaard and Goldberg (2016) ', 'type': 'abstractive'}]",1705.00108.pdf,"['1705.00108.pdf', '1908.11546.pdf', '1911.02086.pdf', '2002.08899.pdf', '1609.00559.pdf', '1902.09314.pdf', '1909.01013.pdf', '1904.10500.pdf', '1701.00185.pdf', '1905.10810.pdf', '1810.06743.pdf', '1809.09795.pdf', '1805.04033.pdf', '1911.01799.pdf', '1804.08139.pdf']",Tables TABREF15 and TABREF16 compare results from TagLM with previously published state of the art results without additional labeled data or task specific gazetteers. Tables TABREF17 and TABREF18 compare results of TagLM to other systems that include additional labeled data or gazetteers. ,Semi-supervised sequence tagging with bidirectional language models,"Pre-trained word embeddings learned from unlabeled text have become a
standard component of neural network architectures for NLP tasks. However, in
most cases, the recurrent network that operates on word-level representations
to produce context sensitive representations is trained on relatively little
labeled data. In this paper, we demonstrate a general semi-supervised approach
for adding pre- trained context embeddings from bidirectional language models
to NLP systems and apply it to sequence labeling tasks. We evaluate our model
on two standard datasets for named entity recognition (NER) and chunking, and
in both cases achieve state of the art results, surpassing previous systems
that use other forms of transfer or joint learning with additional labeled data
and task specific gazetteers."
4547818a3bbb727c4bb4a76554b5a5a7b5c5fedb,1905.11901,"What were the different German-English training data sizes, including subsets of the IWSLT14 corpus, used in the TED shared translation task experiments, and how was the development set split in this study?","[{'answer': 'Training data with 159000, 80000, 40000, 20000, 10000 and 5000 sentences, and 7584 sentences for development', 'type': 'abstractive'}, {'answer': 'ultra-low data condition (100k words of training data) and the full IWSLT 14 training corpus (3.2M words)', 'type': 'extractive'}]",1905.11901.pdf,"['1905.11901.pdf', '2003.07723.pdf', '1705.01214.pdf', '1909.11687.pdf', '1911.05153.pdf', '1707.05236.pdf', '1810.05241.pdf', '1611.04642.pdf', '1809.09795.pdf']","We use the TED data from the IWSLT 2014 German INLINEFORM0 English shared translation task BIBREF38 . We use the same data cleanup and train/dev split as BIBREF39 , resulting in 159000 parallel sentences of training data, and 7584 for development.",Revisiting Low-Resource Neural Machine Translation: A Case Study,"It has been shown that the performance of neural machine translation (NMT)
drops starkly in low-resource conditions, underperforming phrase-based
statistical machine translation (PBSMT) and requiring large amounts of
auxiliary data to achieve competitive results. In this paper, we re-assess the
validity of these results, arguing that they are the result of lack of system
adaptation to low-resource settings. We discuss some pitfalls to be aware of
when training low-resource NMT systems, and recent techniques that have shown
to be especially helpful in low-resource settings, resulting in a set of best
practices for low-resource NMT. In our experiments on German--English with
different amounts of IWSLT14 training data, we show that, without the use of
any auxiliary monolingual or multilingual data, an optimized NMT system can
outperform PBSMT with far less data than previously claimed. We also apply
these techniques to a low-resource Korean-English dataset, surpassing
previously reported results by 4 BLEU."
9d578ddccc27dd849244d632dd0f6bf27348ad81,1909.00694,"What are the accuracy results of the BiGRU and BERT models on the ACP test set when trained with different configurations, including the full dataset and subsets, in the paper titled ""Minimally Supervised Learning of Affective Events Using Discourse Relations""?","[{'answer': 'Using all data to train: AL -- BiGRU achieved 0.843 accuracy, AL -- BERT achieved 0.863 accuracy, AL+CA+CO -- BiGRU achieved 0.866 accuracy, AL+CA+CO -- BERT achieved 0.835, accuracy, ACP -- BiGRU achieved 0.919 accuracy, ACP -- BERT achived 0.933, accuracy, ACP+AL+CA+CO -- BiGRU achieved 0.917 accuracy, ACP+AL+CA+CO -- BERT achieved 0.913 accuracy. \nUsing a subset to train: BERT achieved 0.876 accuracy using ACP (6K), BERT achieved 0.886 accuracy using ACP (6K) + AL, BiGRU achieved 0.830 accuracy using ACP (6K), BiGRU achieved 0.879 accuracy using ACP (6K) + AL + CA + CO.', 'type': 'abstractive'}]",1909.00694.pdf,"['1909.00694.pdf', '1912.03457.pdf', '1911.08976.pdf', '1908.11365.pdf', '1912.13109.pdf', '1910.06036.pdf', '1905.00563.pdf']",FLOAT SELECTED: Table 3: Performance of various models on the ACP test set.,Minimally Supervised Learning of Affective Events Using Discourse Relations,"Recognizing affective events that trigger positive or negative sentiment has
a wide range of natural language processing applications but remains a
challenging problem mainly because the polarity of an event is not necessarily
predictable from its constituent words. In this paper, we propose to propagate
affective polarity using discourse relations. Our method is simple and only
requires a very small seed lexicon and a large raw corpus. Our experiments
using Japanese data show that our method learns affective events effectively
without manually labeled data. It also improves supervised learning results
when labeled data are small."
44c4bd6decc86f1091b5fc0728873d9324cdde4e,1909.00694,How many affective event pairs were extracted from both the Japanese web corpus and the ACP corpus in your minimally supervised learning of affective events via discourse relations?,"[{'answer': '7000000 pairs of events were extracted from the Japanese Web corpus, 529850 pairs of events were extracted from the ACP corpus', 'type': 'abstractive'}, {'answer': 'The ACP corpus has around 700k events split into positive and negative polarity ', 'type': 'abstractive'}]",1909.00694.pdf,"['1909.00694.pdf', '1904.05584.pdf', '2004.03744.pdf', '1908.07195.pdf', '1811.02906.pdf', '1909.11467.pdf', '1611.00514.pdf', '1710.09340.pdf', '1710.06700.pdf', '1912.01673.pdf', '1604.00400.pdf', '2002.02492.pdf']","As a raw corpus, we used a Japanese web corpus that was compiled through the procedures proposed by BIBREF13. ",Minimally Supervised Learning of Affective Events Using Discourse Relations,"Recognizing affective events that trigger positive or negative sentiment has
a wide range of natural language processing applications but remains a
challenging problem mainly because the polarity of an event is not necessarily
predictable from its constituent words. In this paper, we propose to propagate
affective polarity using discourse relations. Our method is simple and only
requires a very small seed lexicon and a large raw corpus. Our experiments
using Japanese data show that our method learns affective events effectively
without manually labeled data. It also improves supervised learning results
when labeled data are small."
c029deb7f99756d2669abad0a349d917428e9c12,1909.00694,"What is the percentage improvement in BERT's performance when using the minimally supervised method that propagates affective polarity through discourse relations, when trained on a small set of labeled Japanese data compared to the baseline supervised approach?","[{'answer': '3%', 'type': 'abstractive'}]",1909.00694.pdf,"['1909.00694.pdf', '1704.00939.pdf', '1909.01247.pdf', '2003.03106.pdf', '1912.03457.pdf', '2002.06644.pdf', '1909.00015.pdf', '1805.04033.pdf', '1806.07711.pdf', '2001.08051.pdf', '1809.09795.pdf', '1705.00108.pdf', '1703.06492.pdf', '1704.08960.pdf']","FLOAT SELECTED: Table 4: Results for small labeled training data. Given the performance with the full dataset, we show BERT trained only with the AL data.",Minimally Supervised Learning of Affective Events Using Discourse Relations,"Recognizing affective events that trigger positive or negative sentiment has
a wide range of natural language processing applications but remains a
challenging problem mainly because the polarity of an event is not necessarily
predictable from its constituent words. In this paper, we propose to propagate
affective polarity using discourse relations. Our method is simple and only
requires a very small seed lexicon and a large raw corpus. Our experiments
using Japanese data show that our method learns affective events effectively
without manually labeled data. It also improves supervised learning results
when labeled data are small."
efb3a87845460655c53bd7365bcb8393c99358ec,1706.08032,"What were the accuracy results reported for the STS, Sanders, and HCR datasets when evaluated using the proposed DeepCNN-BiLSTM model for binary sentiment classification?","[{'answer': 'accuracy of 86.63 on STS, 85.14 on Sanders and 80.9 on HCR', 'type': 'abstractive'}]",1706.08032.pdf,"['1706.08032.pdf', '1911.02711.pdf', '1611.02550.pdf', '2003.11563.pdf', '1701.02877.pdf', '1809.09194.pdf', '1911.02086.pdf', '2003.05377.pdf']",FLOAT SELECTED: Table IV ACCURACY OF DIFFERENT MODELS FOR BINARY CLASSIFICATION,A Deep Neural Architecture for Sentence-level Sentiment Classification in Twitter Social Networking,"This paper introduces a novel deep learning framework including a
lexicon-based approach for sentence-level prediction of sentiment label
distribution. We propose to first apply semantic rules and then use a Deep
Convolutional Neural Network (DeepCNN) for character-level embeddings in order
to increase information for word-level embedding. After that, a Bidirectional
Long Short-Term Memory Network (Bi-LSTM) produces a sentence-wide feature
representation from the word-level embedding. We evaluate our approach on three
Twitter sentiment classification datasets. Experimental results show that our
model can improve the classification accuracy of sentence-level sentiment
analysis in Twitter social networking."
d60a3887a0d434abc0861637bbcd9ad0c596caf4,1706.08032,"Which semantic rules, as referenced in the Twitter sentiment classification model, are excluded from the main method because they are used to compute polarity after POS tagging or parsing steps?","[{'answer': 'rules that compute polarity of words after POS tagging or parsing steps', 'type': 'abstractive'}]",1706.08032.pdf,"['1706.08032.pdf', '1909.01958.pdf', '1909.08824.pdf', '1701.09123.pdf', '1702.03342.pdf', '1908.07816.pdf', '2004.03354.pdf', '1912.06670.pdf', '1607.06025.pdf', '1704.08960.pdf', '1810.12885.pdf', '2003.03106.pdf', '2003.01769.pdf', '1704.06194.pdf', '1910.00825.pdf', '1902.00672.pdf', '2002.08899.pdf', '1908.05828.pdf']","In Twitter social networking, people express their opinions containing sub-sentences. These sub-sentences using specific PoS particles (Conjunction and Conjunctive adverbs), like ""but, while, however, despite, however"" have different polarities. However, the overall sentiment of tweets often focus on certain sub-sentences. For example:

@lonedog bwahahah...you are amazing! However, it was quite the letdown.

@kirstiealley my dentist is great but she's expensive...=(

In two tweets above, the overall sentiment is negative. However, the main sentiment is only in the sub-sentences following but and however. This inspires a processing step to remove unessential parts in a tweet. Rule-based approach can assists these problems in handling negation and dealing with specific PoS particles led to effectively affect the final output of classification BIBREF11 BIBREF16 . BIBREF11 summarized a full presentation of their semantic rules approach and devised ten semantic rules in their hybrid approach based on the presentation of BIBREF16 . We use five rules in the semantic rules set because other five rules are only used to compute polarity of words after POS tagging or Parsing steps. We follow the same naming convention for rules utilized by BIBREF11 to represent the rules utilized in our proposed method. The rules utilized in the proposed method are displayed in Table TABREF15 in which is included examples from STS Corpus and output after using the rules. Table TABREF16 illustrates the number of processed sentences on each dataset.",A Deep Neural Architecture for Sentence-level Sentiment Classification in Twitter Social Networking,"This paper introduces a novel deep learning framework including a
lexicon-based approach for sentence-level prediction of sentiment label
distribution. We propose to first apply semantic rules and then use a Deep
Convolutional Neural Network (DeepCNN) for character-level embeddings in order
to increase information for word-level embedding. After that, a Bidirectional
Long Short-Term Memory Network (Bi-LSTM) produces a sentence-wide feature
representation from the word-level embedding. We evaluate our approach on three
Twitter sentiment classification datasets. Experimental results show that our
model can improve the classification accuracy of sentence-level sentiment
analysis in Twitter social networking."
4f243056e63a74d1349488983dc1238228ca76a7,2003.12218,Does the paper provide a complete list of all 75 fine-grained entity types annotated within the CORD-NER dataset?,"[{'answer': 'No', 'type': 'boolean'}]",2003.12218.pdf,"['2003.12218.pdf', '1703.07090.pdf', '1911.00069.pdf', '1909.00361.pdf']",FLOAT SELECTED: Table 2: Examples of the most frequent entities annotated in CORD-NER.,Comprehensive Named Entity Recognition on CORD-19 with Distant or Weak Supervision,"We created this CORD-NER dataset with comprehensive named entity recognition
(NER) on the COVID-19 Open Research Dataset Challenge (CORD-19) corpus
(2020-03-13). This CORD-NER dataset covers 75 fine-grained entity types: In
addition to the common biomedical entity types (e.g., genes, chemicals and
diseases), it covers many new entity types related explicitly to the COVID-19
studies (e.g., coronaviruses, viral proteins, evolution, materials, substrates
and immune responses), which may benefit research on COVID-19 related virus,
spreading mechanisms, and potential vaccines. CORD-NER annotation is a
combination of four sources with different NER methods. The quality of CORD-NER
annotation surpasses SciSpacy (over 10% higher on the F1 score based on a
sample set of documents), a fully supervised BioNER tool. Moreover, CORD-NER
supports incrementally adding new documents as well as adding new entity types
when needed by adding dozens of seeds as the input examples. We will constantly
update CORD-NER based on the incremental updates of the CORD-19 corpus and the
improvement of our system."
