q_id,doc_id,question,answer,doc_path,documents,evidence,title,abstract
40c0f97c3547232d6aa039fcb330f142668dea4b,1709.10367,"Does the empirical evaluation of the S-EFE model, which includes datasets like U.S. Senate speeches, ArXiv papers, and grocery purchases, involve only English-language content?","[{'answer': 'No', 'type': 'boolean'}]",1709.10367.pdf,"['1709.10367.pdf', '1909.08041.pdf', '1910.10288.pdf', '1905.10810.pdf', '1611.04798.pdf']","Data. We apply the sefe on three datasets: ArXiv papers, U.S. Senate speeches, and purchases on supermarket grocery shopping data. We describe these datasets below, and we provide a summary of the datasets in Table TABREF17 .",Structured Embedding Models for Grouped Data,"Word embeddings are a powerful approach for analyzing language, and
exponential family embeddings (EFE) extend them to other types of data. Here we
develop structured exponential family embeddings (S-EFE), a method for
discovering embeddings that vary across related groups of data. We study how
the word usage of U.S. Congressional speeches varies across states and party
affiliation, how words are used differently across sections of the ArXiv, and
how the co-purchase patterns of groceries can vary across seasons. Key to the
success of our method is that the groups share statistical information. We
develop two sharing strategies: hierarchical modeling and amortization. We
demonstrate the benefits of this approach in empirical studies of speeches,
abstracts, and shopping baskets. We show how S-EFE enables group-specific
interpretation of word usage, and outperforms EFE in predicting held-out data."
52f9cd05d8312ae3c7a43689804bac63f7cac34b,1809.03449,"Does the paper introducing the Knowledge Aided Reader (KAR) suggest that humans' robustness to noise in comprehension tasks stems from their ability to use general knowledge, such as the semantic connections extracted via WordNet?","[{'answer': 'Yes', 'type': 'boolean'}, {'answer': 'Yes', 'type': 'boolean'}]",1809.03449.pdf,"['1809.03449.pdf', '1611.03382.pdf', '1808.09920.pdf', '1904.07904.pdf', '1807.07961.pdf', '1901.05280.pdf', '1809.05752.pdf', '1605.07333.pdf', '1906.03538.pdf', '1903.09722.pdf', '1907.03060.pdf', '1912.01214.pdf']","To verify the effectiveness of general knowledge, we first study the relationship between the amount of general knowledge and the performance of KAR. As shown in Table TABREF13 , by increasing INLINEFORM0 from 0 to 5 in the data enrichment method, the amount of general knowledge rises monotonically, but the performance of KAR first rises until INLINEFORM1 reaches 3 and then drops down.",Explicit Utilization of General Knowledge in Machine Reading Comprehension,"To bridge the gap between Machine Reading Comprehension (MRC) models and
human beings, which is mainly reflected in the hunger for data and the
robustness to noise, in this paper, we explore how to integrate the neural
networks of MRC models with the general knowledge of human beings. On the one
hand, we propose a data enrichment method, which uses WordNet to extract
inter-word semantic connections as general knowledge from each given
passage-question pair. On the other hand, we propose an end-to-end MRC model
named as Knowledge Aided Reader (KAR), which explicitly uses the above
extracted general knowledge to assist its attention mechanisms. Based on the
data enrichment method, KAR is comparable in performance with the
state-of-the-art MRC models, and significantly more robust to noise than them.
When only a subset (20%-80%) of the training examples are available, KAR
outperforms the state-of-the-art MRC models by a large margin, and is still
reasonably robust to noise."
b1bc9ae9d40e7065343c12f860a461c7c730a612,1912.0896,"Which specific ShapeWorldICE datasets, including OneShape, MultiShapes, TwoShapes, Count, and Ratio, are described in the paper for evaluating model performance?","[{'answer': 'Existential (OneShape, MultiShapes), Spacial (TwoShapes, Multishapes), Quantification (Count, Ratio) datasets are generated from ShapeWorldICE', 'type': 'abstractive'}, {'answer': 'ShapeWorldICE datasets: OneShape, MultiShapes, TwoShapes, MultiShapes, Count, and Ratio', 'type': 'abstractive'}]",1912.08960.pdf,"['1912.08960.pdf', '1909.06162.pdf', '2002.02492.pdf', '1812.01704.pdf', '1810.05241.pdf', '1909.03544.pdf', '1909.00430.pdf', '1911.13066.pdf', '1707.03569.pdf', '1910.08210.pdf', '1711.02013.pdf', '1704.00939.pdf', '1911.03597.pdf', '1805.03710.pdf', '1911.02711.pdf', '1904.03288.pdf', '1611.03382.pdf']","We develop a variety of ShapeWorldICE datasets, with a similar idea to the â€œskill tasksâ€ in the bAbI framework BIBREF22. Table TABREF4 gives an overview for different ShapeWorldICE datasets we use in this paper.",,
66125cfdf11d3bf8e59728428e02021177142c3a,1911.0331,"How does the data demonstrate that mBERT's language-neutral component leads to better word-alignment performance than FastAlign, even when using large parallel corpora, and what role does explicit projection learning play in this outcome?","[{'answer': 'Table TABREF15 shows that word-alignment based on mBERT representations surpasses the outputs of the standard FastAlign tool even if it was provided large parallel corpus. This suggests that word-level semantics are well captured by mBERT contextual embeddings. For this task, learning an explicit projection had a negligible effect on the performance.', 'type': 'extractive'}, {'answer': 'explicit projection had a negligible effect on the performance', 'type': 'extractive'}]",1911.03310.pdf,"['1911.03310.pdf', '2003.01769.pdf', '1909.09587.pdf', '1902.09393.pdf', '1809.04960.pdf']","Following BIBREF3, we hypothesize that a sentence representation in mBERT is composed of a language-specific component, which identifies the language of the sentence, and a language-neutral component, which captures the meaning of the sentence in a language-independent way. We assume that the language-specific component is similar across all sentences in the language.",,
47a30eb4d0d6f5f2ff4cdf6487265a25c1b18fd8,1909.0043,Does the system trained using expectation regularization (XR) with sentence-level (S) and noisy sentence-level (N) data outperform the fully supervised neural system trained solely with aspect-level data (A) in terms of accuracy and Macro-F1 score for Aspect-based Sentiment Classification?,"[{'answer': 'Yes', 'type': 'boolean'}]",1909.00430.pdf,"['1909.00430.pdf', '2001.00137.pdf', '1904.10500.pdf', '1903.09722.pdf', '2004.01980.pdf', '1908.11365.pdf', '2003.03044.pdf']","FLOAT SELECTED: Table 1: Average accuracies and Macro-F1 scores over five runs with random initialization along with their standard deviations. Bold: best results or within std of them. âˆ— indicates that the methodâ€™s result is significantly better than all baseline methods, â€  indicates that the methodâ€™s result is significantly better than all baselines methods that use the aspect-based data only, with p < 0.05 according to a one-tailed unpaired t-test. The data annotations S, N and A indicate training with Sentence-level, Noisy sentence-level and Aspect-level data respectively. Numbers for TDLSTM+Att,ATAE-LSTM,MM,RAM and LSTM+SynATT+TarRep are from (He et al., 2018a). Numbers for Semisupervised are from (He et al., 2018b).",,
e42fbf6c183abf1c6c2321957359c7683122b48e,1909.0043,"What are the reported accuracy values for the BiLSTM-XR and BiLSTM-XR-Dev Estimation models, trained using only XR loss on the SemEval-15 and SemEval-16 datasets, in the study on aspect-based sentiment classification using Sentence-level, Noisy sentence-level, and Aspect-level data?","[{'answer': 'BiLSTM-XR-Dev Estimation accuracy is 83.31 for SemEval-15 and 87.68 for SemEval-16.\nBiLSTM-XR accuracy is 83.31 for SemEval-15 and 88.12 for SemEval-16.\n', 'type': 'abstractive'}]",1909.00430.pdf,"['1909.00430.pdf', '1811.12254.pdf', '1911.02086.pdf', '1910.00458.pdf', '1905.12260.pdf', '2003.12218.pdf', '1905.11901.pdf', '1904.10503.pdf', '1810.09774.pdf', '1805.03710.pdf', '2001.05467.pdf', '1701.03214.pdf', '1909.03405.pdf', '1712.00991.pdf', '1909.00361.pdf', '1910.11204.pdf', '1912.08960.pdf', '1609.00559.pdf']","FLOAT SELECTED: Table 1: Average accuracies and Macro-F1 scores over five runs with random initialization along with their standard deviations. Bold: best results or within std of them. âˆ— indicates that the methodâ€™s result is significantly better than all baseline methods, â€  indicates that the methodâ€™s result is significantly better than all baselines methods that use the aspect-based data only, with p < 0.05 according to a one-tailed unpaired t-test. The data annotations S, N and A indicate training with Sentence-level, Noisy sentence-level and Aspect-level data respectively. Numbers for TDLSTM+Att,ATAE-LSTM,MM,RAM and LSTM+SynATT+TarRep are from (He et al., 2018a). Numbers for Semisupervised are from (He et al., 2018b).",,
52e8f79814736fea96fd9b642881b476243e1698,1909.13695,"What specific speaker verification systems, including adaptations and fine-tunings of VoxCeleb-based models, are evaluated for their % EER on BULATS and Linguaskill test sets?","[{'answer': 'BULATS i-vector/PLDA\nBULATS x-vector/PLDA\nVoxCeleb x-vector/PLDA\nPLDA adaptation (X1)\n Extractor fine-tuning (X2) ', 'type': 'abstractive'}]",1909.13695.pdf,"['1909.13695.pdf', '1912.06670.pdf', '1810.12885.pdf', '1912.00864.pdf', '2002.01359.pdf', '1810.12196.pdf', '2004.01878.pdf', '1804.07789.pdf', '2003.12738.pdf', '2004.03744.pdf', '1902.09393.pdf', '1911.02711.pdf']",FLOAT SELECTED: Table 2. % EER performance of VoxCeleb-based systems on BULATS and Linguaskill test sets.,Non-native Speaker Verification for Spoken Language Assessment,"Automatic spoken language assessment systems are becoming more popular in
order to handle increasing interests in second language learning. One challenge
for these systems is to detect malpractice. Malpractice can take a range of
forms, this paper focuses on detecting when a candidate attempts to impersonate
another in a speaking test. This form of malpractice is closely related to
speaker verification, but applied in the specific domain of spoken language
assessment. Advanced speaker verification systems, which leverage deep-learning
approaches to extract speaker representations, have been successfully applied
to a range of native speaker verification tasks. These systems are explored for
non-native spoken English data in this paper. The data used for speaker
enrolment and verification is mainly taken from the BULATS test, which assesses
English language skills for business. Performance of systems trained on
relatively limited amounts of BULATS data, and standard large speaker
verification corpora, is compared. Experimental results on large-scale test
sets with millions of trials show that the best performance is achieved by
adapting the imported model to non-native data. Breakdown of impostor trials
across different first languages (L1s) and grades is analysed, which shows that
inter-L1 impostors are more challenging for speaker verification systems."
5a65ad10ff954d0f27bb3ccd9027e3d8f7f6bb76,1904.10503,Which models are directly compared with the authors' ELMo and Wikidata-based approach for fine-grained entity recognition using the Wiki(gold) dataset?,"[{'answer': 'Akbik et al. (2018), Link et al. (2012)', 'type': 'abstractive'}, {'answer': 'They compare to Akbik et al. (2018) and Link et al. (2012).', 'type': 'abstractive'}]",1904.10503.pdf,"['1904.10503.pdf', '2003.11645.pdf', '1909.04002.pdf', '1809.02286.pdf', '1707.00110.pdf', '1906.03538.pdf', '2001.00137.pdf', '1606.05320.pdf', '2002.01359.pdf', '2003.07996.pdf', '2001.08051.pdf', '2001.08868.pdf', '1909.01958.pdf', '1910.06592.pdf', '1909.00279.pdf', '1810.10254.pdf', '1911.08673.pdf', '2003.05377.pdf']",FLOAT SELECTED: Table 3: Comparison with existing models.,Fine-Grained Named Entity Recognition using ELMo and Wikidata,"Fine-grained Named Entity Recognition is a task whereby we detect and
classify entity mentions to a large set of types. These types can span diverse
domains such as finance, healthcare, and politics. We observe that when the
type set spans several domains the accuracy of the entity detection becomes a
limitation for supervised learning models. The primary reason being the lack of
datasets where entity boundaries are properly annotated, whilst covering a
large spectrum of entity types. Furthermore, many named entity systems suffer
when considering the categorization of fine grained entity types. Our work
attempts to address these issues, in part, by combining state-of-the-art deep
learning models (ELMo) with an expansive knowledge base (Wikidata). Using our
framework, we cross-validate our model on the 112 fine-grained entity types
based on the hierarchy given from the Wiki(gold) dataset."
f17ca24b135f9fe6bb25dc5084b13e1637ec7744,1804.05918,"Based on the results reported for the paragraph-level neural network model trained on the PDTB corpus, which explicit discourse relations demonstrate the highest and lowest classification performance?","[{'answer': 'explicit discourse relations', 'type': 'extractive'}, {'answer': 'Best: Expansion (Exp). Worst: Comparison (Comp).', 'type': 'abstractive'}]",1804.05918.pdf,"['1804.05918.pdf', '1902.10525.pdf', '1909.13714.pdf', '1704.05907.pdf', '2003.05377.pdf', '1905.12260.pdf', '1910.03814.pdf', '1909.05855.pdf', '1905.06566.pdf', '1910.11769.pdf', '1809.00530.pdf', '1606.05320.pdf', '1603.00968.pdf', '1804.00079.pdf', '1902.09314.pdf', '1910.12129.pdf']","the basic model yields good performance for recognizing explicit discourse relations as well, which is comparable with previous best result (92.05% macro F1-score and 93.09% accuracy as reported in BIBREF11 ).",Improving Implicit Discourse Relation Classification by Modeling Inter-dependencies of Discourse Units in a Paragraph,"We argue that semantic meanings of a sentence or clause can not be
interpreted independently from the rest of a paragraph, or independently from
all discourse relations and the overall paragraph-level discourse structure.
With the goal of improving implicit discourse relation classification, we
introduce a paragraph-level neural networks that model inter-dependencies
between discourse units as well as discourse relation continuity and patterns,
and predict a sequence of discourse relations in a paragraph. Experimental
results show that our model outperforms the previous state-of-the-art systems
on the benchmark corpus of PDTB."
fc8bc6a3c837a9d1c869b7ee90cf4e3c39bcd102,1905.06566,"Does the paper provide a comparison between hierarchical models like HiBERT and non-hierarchical models such as BERT, evaluated as baselines on the CNNDM dataset?","[{'answer': 'There were hierarchical and non-hierarchical baselines; BERT was one of those baselines', 'type': 'abstractive'}]",1905.06566.pdf,"['1905.06566.pdf', '1909.13375.pdf', '2002.01664.pdf', '1910.00825.pdf', '1910.06592.pdf', '1901.03866.pdf', '1908.11047.pdf', '1809.02286.pdf', '1911.03310.pdf']","FLOAT SELECTED: Table 1: Results of various models on the CNNDM test set using full-length F1 ROUGE-1 (R-1), ROUGE-2 (R2), and ROUGE-L (R-L).",HIBERT: Document Level Pre-training of Hierarchical Bidirectional Transformers for Document Summarization,"Neural extractive summarization models usually employ a hierarchical encoder
for document encoding and they are trained using sentence-level labels, which
are created heuristically using rule-based methods. Training the hierarchical
encoder with these \emph{inaccurate} labels is challenging. Inspired by the
recent work on pre-training transformer sentence encoders
\cite{devlin:2018:arxiv}, we propose {\sc Hibert} (as shorthand for {\bf
HI}erachical {\bf B}idirectional {\bf E}ncoder {\bf R}epresentations from {\bf
T}ransformers) for document encoding and a method to pre-train it using
unlabeled data. We apply the pre-trained {\sc Hibert} to our summarization
model and it outperforms its randomly initialized counterpart by 1.25 ROUGE on
the CNN/Dailymail dataset and by 2.0 ROUGE on a version of New York Times
dataset. We also achieve the state-of-the-art performance on these two
datasets."
4704cbb35762d0172f5ac6c26b67550921567a65,1811.02906,What are the percentage improvements in F1 score and accuracy for the top-performing transfer learning strategy in Task 1 in the paper on BiLSTM-CNN neural networks and background knowledge transfer for offensive language detection on German Twitter data?,"[{'answer': 'In task 1 best transfer learning strategy improves F1 score by 4.4% and accuracy score by 3.3%, in task 2 best transfer learning strategy improves F1 score by 2.9% and accuracy score by 1.7%', 'type': 'abstractive'}]",1811.02906.pdf,"['1811.02906.pdf', '1910.06036.pdf', '1912.01214.pdf', '1612.08205.pdf', '1910.07481.pdf', '1909.13375.pdf', '1908.08345.pdf']",FLOAT SELECTED: Table 2: Transfer learning performance (Task 1),Transfer Learning from LDA to BiLSTM-CNN for Offensive Language Detection in Twitter,"We investigate different strategies for automatic offensive language
classification on German Twitter data. For this, we employ a sequentially
combined BiLSTM-CNN neural network. Based on this model, three transfer
learning tasks to improve the classification performance with background
knowledge are tested. We compare 1. Supervised category transfer: social media
data annotated with near-offensive language categories, 2. Weakly-supervised
category transfer: tweets annotated with emojis they contain, 3. Unsupervised
category transfer: tweets annotated with topic clusters obtained by Latent
Dirichlet Allocation (LDA). Further, we investigate the effect of three
different strategies to mitigate negative effects of 'catastrophic forgetting'
during transfer learning. Our results indicate that transfer learning in
general improves offensive language detection. Best results are achieved from
pre-training our model on the unsupervised topic clustering of tweets in
combination with thematic user cluster information."
4e9684fd68a242cb354fa6961b0e3b5c35aae4b6,1910.03814,"What are the F-score, AUC, and mean accuracy values comparing the unimodal LSTM model and the best multimodal model (FCM) for hate speech detection on the MMHS150K dataset?","[{'answer': 'Unimodal LSTM vs Best Multimodal (FCM)\n- F score: 0.703 vs 0.704\n- AUC: 0.732 vs 0.734 \n- Mean Accuracy: 68.3 vs 68.4 ', 'type': 'abstractive'}]",1910.03814.pdf,"['1910.03814.pdf', '1705.01265.pdf', '2003.03044.pdf', '1809.01202.pdf', '1905.06566.pdf', '1910.12129.pdf', '1607.06025.pdf', '1704.05907.pdf', '1908.07195.pdf', '1908.08345.pdf', '1909.03405.pdf', '1711.11221.pdf', '1905.00563.pdf', '1910.11204.pdf', '1804.08139.pdf']","Table TABREF31 shows the F-score, the Area Under the ROC Curve (AUC) and the mean accuracy (ACC) of the proposed models when different inputs are available.",Exploring Hate Speech Detection in Multimodal Publications,"In this work we target the problem of hate speech detection in multimodal
publications formed by a text and an image. We gather and annotate a large
scale dataset from Twitter, MMHS150K, and propose different models that jointly
analyze textual and visual information for hate speech detection, comparing
them with unimodal detection. We provide quantitative and qualitative results
and analyze the challenges of the proposed task. We find that, even though
images are useful for the hate speech detection task, current multimodal models
cannot outperform models analyzing only text. We discuss why and open the field
and the dataset for further research."
01edeca7b902ae3fd66264366bf548acea1db364,1808.0343,"What recall scores for positions 1, 2, and 5 were reported for the introduced method when evaluated with 10 candidates in the comparison of different models?","[{'answer': 'Their model resulted in values of 0.476, 0.672 and 0.893 for recall at position 1,2 and 5 respectively in 10 candidates.', 'type': 'abstractive'}]",1808.03430.pdf,"['1808.03430.pdf', '1909.11687.pdf', '1909.00175.pdf', '1910.06592.pdf', '1909.00430.pdf', '1605.07683.pdf', '1704.05907.pdf']",FLOAT SELECTED: Table 1: Comparison of different models.,,
7c794fa0b2818d354ca666969107818a2ffdda0c,1910.00912,"Apart from entity tagging, what combined metrics for intent and entities are reported in HERMIT NLU's evaluation results?","[{'answer': 'We also report the metrics in BIBREF7 for consistency, we report the span F1,  Exact Match (EM) accuracy of the entire sequence of labels, metric that combines intent and entities', 'type': 'extractive'}]",1910.00912.pdf,"['1910.00912.pdf', '1909.03405.pdf', '1605.07683.pdf', '1910.02339.pdf', '1908.06267.pdf']","Following BIBREF7, we then evaluated a metric that combines intent and entities, computed by simply summing up the two confusion matrices (Table TABREF23). Results highlight the contribution of the entity tagging task, where HERMIT outperforms the other approaches. Paired-samples t-tests were conducted to compare the HERMIT combined F1 against the other systems.",Hierarchical Multi-Task Natural Language Understanding for Cross-domain Conversational AI: HERMIT NLU,"We present a new neural architecture for wide-coverage Natural Language
Understanding in Spoken Dialogue Systems. We develop a hierarchical multi-task
architecture, which delivers a multi-layer representation of sentence meaning
(i.e., Dialogue Acts and Frame-like structures). The architecture is a
hierarchy of self-attention mechanisms and BiLSTM encoders followed by CRF
tagging layers. We describe a variety of experiments, showing that our approach
obtains promising results on a dataset annotated with Dialogue Acts and Frame
Semantics. Moreover, we demonstrate its applicability to a different, publicly
available NLU dataset annotated with domain-specific intents and corresponding
semantic roles, providing overall performance higher than state-of-the-art
tools such as RASA, Dialogflow, LUIS, and Watson. For example, we show an
average 4.45% improvement in entity tagging F-score over Rasa, Dialogflow and
LUIS."
9ecde59ffab3c57ec54591c3c7826a9188b2b270,2003.04642,"Which MRC gold standards published between 2016 and 2019, meeting the citation-based thresholds and aligned with the problem definition in this study, were analyzed for features like lexical ambiguity, factual correctness, and the presence of lexical cues as part of their answer selection styles?","[{'answer': 'fit our problem definition and were published in the years 2016 to 2019, have at least $(2019 - publication\\ year) \\times 20$ citations', 'type': 'extractive'}, {'answer': 'MSMARCO,  HOTPOTQA, RECORD,  MULTIRC, NEWSQA, and DROP.', 'type': 'abstractive'}]",2003.04642.pdf,"['2003.04642.pdf', '1910.03814.pdf', '2003.03014.pdf', '1609.00559.pdf', '1611.00514.pdf', '2004.03354.pdf', '1909.01013.pdf', '1810.00663.pdf', '1910.03467.pdf']","Concretely, we selected gold standards that fit our problem definition and were published in the years 2016 to 2019, have at least $(2019 - publication\ year) \times 20$ citations, and bucket them according to the answer selection styles as described in Section SECREF4",A Framework for Evaluation of Machine Reading Comprehension Gold Standards,"Machine Reading Comprehension (MRC) is the task of answering a question over
a paragraph of text. While neural MRC systems gain popularity and achieve
noticeable performance, issues are being raised with the methodology used to
establish their performance, particularly concerning the data design of gold
standards that are used to evaluate them. There is but a limited understanding
of the challenges present in this data, which makes it hard to draw comparisons
and formulate reliable hypotheses. As a first step towards alleviating the
problem, this paper proposes a unifying framework to systematically investigate
the present linguistic features, required reasoning and background knowledge
and factual correctness on one hand, and the presence of lexical cues as a
lower bound for the requirement of understanding on the other hand. We propose
a qualitative annotation schema for the first and a set of approximative
metrics for the latter. In a first application of the framework, we analyse
modern MRC gold standards and present our findings: the absence of features
that contribute towards lexical ambiguity, the varying factual correctness of
the expected answers and the presence of lexical cues, all of which potentially
lower the reading comprehension complexity and quality of the evaluation data."
